round	commit	score	delta	status	description
0	c4ce64d	687.58	0	baseline	baseline (asset as-is)
1	2f6ecd3	716.39	+28.81	keep	Route-1 care price 300->200: care-price elasticity now resists, so the ceiling is no longer optimal; expect the interior optimum ~EUR200/mo
2	1d15f42	1386.8	+670.41	keep	Capacity 15->32 h/wk: subcontracting makes added hours productive (more served clients) and freed-hour reinvestment makes idle capacity neutral, so the v1 low-capacity artifact should lift toward the market-saturating knee
3	59bf394	2038.9	+652.1	keep	Route allocation 0.5/0.5 -> 0.24 local / 0.76 b2b: subcontracted B2B scales far past v1's solo-service cap, so tilt hours to B2B while keeping enough local to saturate its care-annuity pool (expect a mixed optimum, not a corner)
4	b9b63dc	2123.84	+84.94	keep	Route-2 retainer 2400->2500: retainer elasticity is mild, so pricing at the top of what service capacity can hold still nets more (confirms the v1 'price at service capacity' finding under the v2 model)
5	c7ff6fd	2123.84	NA	discard	PROBE capacity 32->40: at cap 32 both channels already saturate (Route-2 at market cap, Route-1 at pool), so extra hours reinvest neutrally; expect DISCARD, confirming 32 is the interior knee not a peg-to-max
6	8aeadbf	1987.25	NA	discard	PROBE allocation -> b2b 1.0 (drop local): tests whether the model wants a mono-channel corner; expect DISCARD because Route-1's care annuity adds above-opportunity surplus up to its pool, so the optimum is a MIXED allocation not all-B2B
7	72f85d1	2123.11	NA	discard	PROBE build price 1200->1500 (up from floor): build conversion is elastic and recurring care dominates, so raising the build price should shed clients faster than it adds per-deal revenue; expect DISCARD, confirming loss-lead the build survives the v2 model
8	2d1098d	2116.48	NA	discard	PROBE care price 200->250 (up from interior): care-price elasticity makes uptake/retention fall faster than price rises past ~EUR200; expect DISCARD, confirming 200 is a true interior peak (not a lower-is-always-better slide to zero)
9	-	NA	NA	stopped	converged: 687.58 -> 2123.84 kEUR total surplus; all levers confirmed at optimum (4 keeps: care->200, capacity->32, allocation->0.76 b2b, retainer->2500; 4 boundary probes discarded: capacity knee, mixed-not-corner, build floor, care interior peak)
