round	commit	score	delta	status	description
0	05a828e	2649.94	0	baseline	baseline (asset as-is)
1	f6387ae	3453.07	+803.13	keep	widen the entry tier: drop good to EUR650/scope0.20 so the numerous low-WTP micro segment actually buys a cheap thin plan (the flat baseline priced it out entirely)
2	6c48a8a	4775.09	+1322.02	keep	differentiate the mid tier and capture the premium segment in one coupled move: thin better to EUR1850/scope0.55 and raise best to EUR6300. The levers are incentive-coupled - raising best alone makes the scale segment defect DOWN to the cheaper better tier (more surplus there); thinning better removes that outside option so scale stays in best and pays for it
3	6a45698	3103.65	NA	discard	probe: push best to EUR8500 to over-extract from the premium segment - expect the scale segment to defect down to better (incentive-compatibility ceiling on the best price)
4	dc00ff7	769.48	NA	discard	probe: fatten the entry tier to scope 0.45 (near better's 0.55) - expect the mid core segment to trade DOWN to the cheap good tier (cannibalization); the entry tier must stay deliberately thin
5	c397f66	3971.96	NA	discard	probe: drop the entry tier (fold good up to equal better) - expect to lose the numerous micro segment entirely, testing whether the cheap thin plan earns its place in the menu
6	fb8427e	3103.65	NA	discard	probe: collapse the premium tier (best = better) - expect the scale segment to pay only EUR1850 instead of EUR6300, testing whether a distinct high tier earns its place by capturing premium willingness-to-pay
7	-	NA	NA	stopped	user stop
